{
  "$schema": "https://json-schema.org/draft/2020-12/schema",
  "$id": "https://github.com/kollektiv-mc/Kollektiv/design/suite.schema.json",
  "title": "Kollektiv suite manifest",
  "description": "The per-repo manifest every suite-kit skill reads before doing anything. Product-specific facts live here, next to the code they constrain, rather than inside the plugin — which is what keeps the plugin's skills generic. A skill that cannot find this file says so and stops rather than guessing; this schema exists so that a file which is found is also trustworthy. See docs/adopting.md.",
  "type": "object",
  "required": ["product", "kind", "roadmap", "health"],
  "additionalProperties": false,

  "$defs": {
    "repoRelativePath": {
      "type": "string",
      "minLength": 1,
      "pattern": "^[^/]",
      "description": "A path relative to the repo root. Leading slashes are rejected so that a path is never accidentally absolute on one machine and relative on another."
    },

    "healthCommand": {
      "type": "object",
      "required": ["name", "run"],
      "additionalProperties": false,
      "properties": {
        "name": {
          "type": "string",
          "minLength": 1,
          "description": "Label for the health report table. Short and lowercase — 'typecheck', not 'Run the TypeScript compiler'."
        },
        "run": {
          "type": "string",
          "minLength": 1,
          "description": "The command, run through a shell."
        },
        "cwd": {
          "allOf": [{ "$ref": "#/$defs/repoRelativePath" }],
          "description": "Working directory for this command, relative to the repo root. Defaults to the repo root. This is what lets one ordered list mix toolchains living at different depths — Konnekt runs pnpm from frontend/ and go from the root."
        }
      }
    },

    "healthInvariant": {
      "type": "object",
      "description": "A grep that must find nothing. These are the checks a linter cannot express.",
      "required": ["name", "grep", "paths", "expect", "diagnosis", "reference"],
      "additionalProperties": false,
      "properties": {
        "name": { "type": "string", "minLength": 1 },
        "grep": {
          "type": "string",
          "minLength": 1,
          "description": "Regular expression. A match is a candidate, not a finding — the diagnosis says how to judge it."
        },
        "paths": {
          "type": "array",
          "minItems": 1,
          "items": { "$ref": "#/$defs/repoRelativePath" },
          "description": "Paths the invariant covers. Required and non-empty: an invariant applied to the wrong paths is worse than no invariant, because it reports clean."
        },
        "exclude": {
          "type": "array",
          "items": { "type": "string", "minLength": 1 },
          "description": "Glob patterns exempted from the search. May be empty, but must be stated deliberately."
        },
        "expect": {
          "enum": ["no matches"],
          "description": "The only supported expectation today. Present so that a future inverted check is a schema change rather than a silent reinterpretation of existing entries."
        },
        "diagnosis": {
          "type": "string",
          "minLength": 40,
          "description": "What a match means, the specific silent failure behind it, and any legitimate exception. Required, and required to be substantial: an invariant without a stated reason gets deleted the first time it is inconvenient, and a reviewer with no diagnosis judges a match against the regex instead of against the rule."
        },
        "reference": {
          "allOf": [{ "$ref": "#/$defs/repoRelativePath" }],
          "description": "The document explaining why this rule exists, to be read before deciding a match is acceptable."
        }
      }
    },

    "healthGenerated": {
      "type": "object",
      "description": "A generator whose output is committed. Re-running it must change nothing.",
      "required": ["regenerate", "expectCleanDiff", "requiresNetwork", "diagnosis", "reference"],
      "additionalProperties": false,
      "properties": {
        "regenerate": { "type": "string", "minLength": 1 },
        "cwd": { "$ref": "#/$defs/repoRelativePath" },
        "expectCleanDiff": {
          "type": "array",
          "minItems": 1,
          "items": { "$ref": "#/$defs/repoRelativePath" },
          "description": "Repo-relative paths that must be unchanged after the generator runs. A non-empty diff means either a generated file was hand-edited or a generator change was committed without its output."
        },
        "requiresNetwork": {
          "type": "boolean",
          "description": "Whether the generator fetches. When true and the machine is offline, the check is reported as skipped with that reason — never as passing."
        },
        "diagnosis": { "type": "string", "minLength": 40 },
        "reference": { "$ref": "#/$defs/repoRelativePath" }
      }
    }
  },

  "oneOf": [
    {
      "required": ["linear"],
      "not": { "required": ["tracking"] },
      "title": "Tracked in Linear"
    },
    {
      "required": ["tracking"],
      "not": { "required": ["linear"] },
      "title": "Tracked outside Linear"
    }
  ],

  "properties": {
    "$schema": { "type": "string" },

    "product": {
      "type": "string",
      "minLength": 1,
      "description": "Display name, as it should appear in a report."
    },

    "kind": {
      "type": "string",
      "minLength": 1,
      "description": "Stack shape. Free-form so a fourth product on an unanticipated stack is not a schema change. Known values: 'wails-desktop', 'vite-web', 'workspace-root'."
    },

    "linear": {
      "type": "object",
      "required": ["team"],
      "additionalProperties": false,
      "description": "Present when this repo is tracked in Linear directly, bypassing the GitHub-Issues mirror. Exactly one of 'linear' or 'tracking' must be set — tracking is a per-repo choice, and a repo that declares neither would leave /suite-kit:suite-sync guessing where its issues live.",
      "properties": {
        "team": {
          "type": "string",
          "pattern": "^[A-Z][A-Z0-9]{1,5}$",
          "description": "Team key, e.g. 'KOL'. A key declared here may not yet be provisioned in the workspace — declaring a key and creating the team are different steps."
        }
      }
    },

    "tracking": {
      "enum": ["github-issues"],
      "description": "Present when this repo's issues live on GitHub, which /suite-kit:suite-sync then mirrors into Linear. Every repo in the suite uses this today — GitHub Issues is the one source of truth for work items across the suite."
    },

    "roadmap": {
      "allOf": [{ "$ref": "#/$defs/repoRelativePath" }],
      "description": "Direction and sequencing only — not a work-item list. Work items live in GitHub Issues; /suite-kit:suite-sync mirrors them into Linear, matching on a 'Source: <owner>/<repo>#<number>' line in each Linear issue's description, never on titles."
    },

    "tokens": {
      "type": "object",
      "required": ["role", "source", "sourceFile", "generate", "enforce", "paths"],
      "additionalProperties": false,
      "description": "Omitted by the workspace root, which authors the token set as raw data rather than styled application code.",
      "properties": {
        "role": {
          "enum": ["consumer"],
          "description": "Always 'consumer' in a repo carrying this file. The set is defined in kollektiv's design/tokens.json and nowhere else — a repo that both produced and consumed it is the round trip that makes regeneration unsafe."
        },
        "source": {
          "enum": ["kollektiv"],
          "description": "The repo the values come from."
        },
        "sourceFile": {
          "allOf": [{ "$ref": "#/$defs/repoRelativePath" }],
          "description": "The vendored copy of that source, conventionally 'tokens.source.json'. Vendored rather than referenced so a product builds from a standalone clone. Editing it directly is a mistake: the next sync-tokens.sh overwrites it and the other product never sees the value."
        },
        "generate": {
          "type": "string",
          "minLength": 1,
          "description": "Command that regenerates this repo's token output from the vendored source."
        },
        "enforce": {
          "enum": ["strict", "migrating"],
          "description": "'strict' — a literal hex or arbitrary px in the covered paths is a failure. 'migrating' — pre-existing matches are expected and reported, not mass-rewritten, while new code is held to strict."
        },
        "paths": {
          "type": "array",
          "minItems": 1,
          "items": { "$ref": "#/$defs/repoRelativePath" },
          "description": "Paths the no-literals rule covers."
        }
      }
    },

    "minecraft": {
      "type": "object",
      "required": ["targetVersion", "dataSource", "traitMatrix"],
      "additionalProperties": false,
      "description": "Omitted by a repo that emits no Minecraft commands.",
      "properties": {
        "targetVersion": {
          "type": "string",
          "pattern": "^1\\.[0-9]+(\\.[0-9]+)?$",
          "description": "The version this repo emits for."
        },
        "dataSource": {
          "type": "string",
          "minLength": 1,
          "description": "Where pinned registry data comes from, including how it is pinned. Pin by tag, never by branch — a branch makes a reproducible build a moving target."
        },
        "traitMatrix": {
          "allOf": [{ "$ref": "#/$defs/repoRelativePath" }],
          "description": "The version-trait document. Serializers branch on a named trait from this matrix and never compare version strings."
        }
      }
    },

    "distribution": {
      "type": "object",
      "required": ["current", "doc"],
      "additionalProperties": false,
      "description": "How this product reaches its users, for a repo that ships more than one build from one codebase. 'kind' names the stack; this names what is actually released today and what is on the way. Present so that a product which is both a web app and a desktop binary is not forced to pick one for a single-valued field. Omitted by a repo with one build and by the workspace root.",
      "properties": {
        "current": {
          "type": "array",
          "minItems": 1,
          "items": { "type": "string", "minLength": 1 },
          "description": "Builds a user can obtain today. Free-form names, e.g. 'web', 'desktop-wails-v2'."
        },
        "planned": {
          "type": "array",
          "items": { "type": "string", "minLength": 1 },
          "description": "Builds that exist in the tree but have no release producing installable artefacts yet. A shell that compiles is not the same as a build users can get, and this list is where that distinction is recorded."
        },
        "doc": {
          "allOf": [{ "$ref": "#/$defs/repoRelativePath" }],
          "description": "The document describing the builds and the boundary between them."
        },
        "issue": {
          "type": "string",
          "pattern": "^https://github\\.com/[^/]+/[^/]+/issues/[0-9]+$",
          "description": "The GitHub issue tracking the planned build, if one is open."
        },
        "note": {
          "type": "string",
          "minLength": 1,
          "description": "Anything the lists above cannot say, kept short. The document named in 'doc' is where the reasoning belongs; this is a pointer into it, not a second copy."
        }
      }
    },

    "docs": {
      "type": "object",
      "minProperties": 1,
      "additionalProperties": { "$ref": "#/$defs/repoRelativePath" },
      "propertyNames": { "pattern": "^[a-z][a-zA-Z0-9]*$" },
      "description": "Named entry points into the repo's documentation, for a skill or a person that needs the architecture or persistence document without guessing its path. camelCase names to repo-relative paths. Like 'roadmap' above, every path named here must exist; scripts/check-participation.sh checks that it does."
    },

    "health": {
      "type": "object",
      "required": ["commands"],
      "additionalProperties": false,
      "description": "What this repo's health means. /suite-kit:health runs every entry and does not stop at the first failure.",
      "properties": {
        "commands": {
          "type": "array",
          "minItems": 1,
          "items": { "$ref": "#/$defs/healthCommand" },
          "description": "Ordered. An entry that cannot run yet is reported as skipped with a reason, never as passing."
        },
        "invariants": {
          "type": "array",
          "items": { "$ref": "#/$defs/healthInvariant" },
          "description": "Omitted where the repo has none. Nothing is invented to fill the slot."
        },
        "generated": {
          "type": "array",
          "items": { "$ref": "#/$defs/healthGenerated" },
          "description": "A repo may have more than one generator."
        }
      }
    }
  }
}
